{
  "schema_version": 1,
  "kind": "api.functions",
  "data": [
    {
      "name": "core_webservice_get_site_info",
      "version": "2026042003",
      "reviewed": true,
      "mutates": false,
      "retry": "safe",
      "why": "reads the account's own capabilities"
    }
  ],
  "meta": {
    "site": "rec",
    "account": "env",
    "source": "ws",
    "partial": false,
    "missing": [],
    "next_cursor": null
  }
}
